{
  "$schema": "https://json-schema.org/draft/2020-12/schema",
  "type": "object",
  "required": ["issue", "environment", "repositories", "verification"],
  "additionalProperties": false,
  "properties": {
    "issue": {
      "type": "object",
      "required": ["expected", "actual", "steps"],
      "additionalProperties": false,
      "properties": {
        "id": {"type": "string", "minLength": 1},
        "expected": {"type": "string", "minLength": 1},
        "actual": {"type": "string", "minLength": 1},
        "steps": {"type": "array", "minItems": 1, "items": {"type": "string", "minLength": 1}}
      }
    },
    "context": {
      "type": "object",
      "additionalProperties": false,
      "properties": {
        "product": {"type": "string", "minLength": 1},
        "product_version": {"type": "string", "minLength": 1},
        "business_project": {"type": "string", "minLength": 1}
      }
    },
    "environment": {
      "type": "object",
      "required": ["name", "target"],
      "additionalProperties": false,
      "properties": {
        "name": {"type": "string", "minLength": 1},
        "target": {"type": "string", "minLength": 1}
      }
    },
    "repositories": {
      "type": "array",
      "minItems": 1,
      "items": {
        "type": "object",
        "required": ["name", "path", "branch"],
        "additionalProperties": false,
        "properties": {
          "name": {"type": "string", "minLength": 1},
          "path": {"type": "string", "minLength": 1},
          "branch": {"type": "string", "minLength": 1}
        }
      }
    },
    "verification": {
      "type": "object",
      "required": ["channels"],
      "additionalProperties": false,
      "properties": {
        "channels": {"type": "array", "minItems": 1, "items": {"type": "string", "minLength": 1}},
        "mutating": {"type": "boolean"}
      }
    }
  }
}
